[
  {
    "id": "BOOT-01",
    "title": "Complete the requested planning scaffold",
    "description": "Provide governing contracts, every scoped implementation ticket, a ticket schema, validation tools, synthetic examples, and reviewable committed progress.",
    "source": "User request on 2026-10-08: create the scaffold, every ticket, ticket folder and schema; current correction: you are supposed to build it out."
  },
  {
    "id": "CIV-01",
    "title": "Neutral civic profile boundary",
    "description": "Keep civic legal concepts and jurisdiction parsing out of the neutral Matter core; consume versioned domain profiles and host authority attestations.",
    "source": "User clarification, 2026-10-08, active Matter build: DIAT owns meeting learning; roughly 315 hours/5–10 recurring people is user-reported; crawler owns jurisdiction knowledge; private exported-data experiments only. Original repository inputs: matterbrainstormspec; matterjevmesh; jevinmatter (brainstorming, not implementation evidence)."
  },
  {
    "id": "CIV-02",
    "title": "Scoped jurisdiction authority manifests",
    "description": "Version body/category/time-specific capability assertions, jurisdiction overrides and their evidence; do not treat parser final/recommendation tags as proof of legal power.",
    "source": "https://github.com/mfreeze77/statecivics-local-crawler/blob/f2fd7d39f97fb4f3510e3edef9c0c852e0b5f36f/src/civic_crawler/jurisdictions/ks/ks_county_wyandotte/minutes.json https://github.com/mfreeze77/statecivics-local-crawler/blob/f2fd7d39f97fb4f3510e3edef9c0c852e0b5f36f/tickets/T-087-source-backed-motion-intent-and-vote-mechanics.md"
  },
  {
    "id": "CIV-03",
    "title": "Observed claims remain source claims",
    "description": "Preserve raw stated claims, exact locators and claim-relative support/contradiction before any accepted action; do not let extraction resolve authority or identity.",
    "source": "https://github.com/mfreeze77/statecivics-local-crawler/blob/f2fd7d39f97fb4f3510e3edef9c0c852e0b5f36f/tickets/T-090-matter-identity-case-parties-and-lifecycle-exports.md"
  },
  {
    "id": "CIV-04",
    "title": "Matters differ from occurrences and instruments",
    "description": "Scope legal identifiers by issuer/jurisdiction/type/year, retain agenda appearances and motions as occurrences, and support distinct instruments and corrections without title-only merges.",
    "source": "https://github.com/mfreeze77/statecivics-local-crawler/blob/f2fd7d39f97fb4f3510e3edef9c0c852e0b5f36f/tickets/T-090-matter-identity-case-parties-and-lifecycle-exports.md Original repository inputs: matterbrainstormspec; matterjevmesh; jevinmatter (brainstorming, not implementation evidence)."
  },
  {
    "id": "CIV-05",
    "title": "Temporal coverage and stage integrity",
    "description": "Separate occurrence, publication, capture, availability, review and effective clocks; preserve unknown thresholds and coverage; model funding/procurement/legal stages as sourced dimensions rather than an ordinal score.",
    "source": "Original repository inputs: matterbrainstormspec; matterjevmesh; jevinmatter (brainstorming, not implementation evidence). https://github.com/mfreeze77/statecivics-local-crawler/blob/f2fd7d39f97fb4f3510e3edef9c0c852e0b5f36f/tickets/T-087-source-backed-motion-intent-and-vote-mechanics.md"
  },
  {
    "id": "CIV-06",
    "title": "Purpose-specific useful attention",
    "description": "Evaluate consequences against an explicit objective and audience; changes in preferences do not alter civic evidence or authority.",
    "source": "Original repository inputs: matterbrainstormspec; matterjevmesh; jevinmatter (brainstorming, not implementation evidence)."
  },
  {
    "id": "CIV-07",
    "title": "Receiver compatibility and refusal",
    "description": "Pin producer/consumer schema/profile versions; reject unsupported consequential fields and preserve source evidence for later receiving review.",
    "source": "https://github.com/mfreeze77/statecivics-local-crawler/blob/f2fd7d39f97fb4f3510e3edef9c0c852e0b5f36f/tickets/T-090-matter-identity-case-parties-and-lifecycle-exports.md"
  },
  {
    "id": "CIV-08",
    "title": "Source-backed body relationships",
    "description": "Represent related jurisdictions, authorities, joint sittings and body changes from sources, leaving unsupported relationships unknown.",
    "source": "https://github.com/mfreeze77/statecivics-local-crawler/blob/f2fd7d39f97fb4f3510e3edef9c0c852e0b5f36f/tickets/T-104-related-jurisdiction-and-authority-relationships.md User clarification, 2026-10-08, active Matter build: DIAT owns meeting learning; roughly 315 hours/5–10 recurring people is user-reported; crawler owns jurisdiction knowledge; private exported-data experiments only."
  },
  {
    "id": "CIV-09",
    "title": "Correction and withdrawal dependencies",
    "description": "Withdrawn sources and revised authority manifests invalidate dependent assessments/queued advice; they do not rewrite historical knowledge or original observations.",
    "source": "Original repository inputs: matterbrainstormspec; matterjevmesh; jevinmatter (brainstorming, not implementation evidence)."
  },
  {
    "id": "CORE-01",
    "title": "Portable information and operation contract",
    "description": "Versioned domain-neutral schemas define scoped references, canonical bytes, explicit result states, and stable semantic failures. Structural validation does not claim runtime qualification.",
    "source": "docs/contracts/core.md"
  },
  {
    "id": "CORE-02",
    "title": "Durability, atomicity, and concurrency",
    "description": "Mutations and receipts commit atomically with scoped uniqueness, command idempotency, consistent reads, and revision checks. Restart and storage failure preserve honest durable outcomes.",
    "source": "docs/contracts/core.md"
  },
  {
    "id": "CORE-03",
    "title": "Observation identity and redelivery discipline",
    "description": "Observations preserve original content and provenance; source-event redelivery is idempotent, incompatible identity reuse conflicts, and corrections append explicit revisions.",
    "source": "docs/contracts/core.md"
  },
  {
    "id": "CORE-04",
    "title": "Continuing matters independent of runs and assessments",
    "description": "Matter identity survives processing runs, rewording, policies, and audiences. Scoped domain keys establish identity; titles and run IDs do not.",
    "source": "docs/contracts/core.md"
  },
  {
    "id": "CORE-05",
    "title": "Occurrence and provenance-group semantics",
    "description": "Reports, happenings, and independent corroboration are separately represented. Derived summaries retain parent provenance and genuine recurrence remains countable.",
    "source": "docs/contracts/core.md"
  },
  {
    "id": "CORE-06",
    "title": "Claim-specific evidence without automatic truth promotion",
    "description": "Evidence relations target scoped propositions and qualifiers. Source assertions remain separate from assessed truth, established authority, identity, and actions.",
    "source": "docs/contracts/core.md"
  },
  {
    "id": "CORE-07",
    "title": "Association uncertainty and acceptance authority",
    "description": "Proposals preserve candidates and ambiguity; acceptance checks current revisions and explicit policy authority. No-match, insufficient evidence, conflict, and evaluator failure remain distinct.",
    "source": "docs/contracts/core.md"
  },
  {
    "id": "CORE-08",
    "title": "Non-destructive equivalence and relationship correction",
    "description": "Links retain separate identities; authorized merges preserve redirects, conflicts, and movement receipts. Undo and split restore a valid partition without erasing historical assessments.",
    "source": "docs/contracts/core.md"
  },
  {
    "id": "CORE-09",
    "title": "Time and absence are evidenced inputs",
    "description": "Event, effective, publication, availability, ingestion, and assessment times remain distinct. Absence requires declared coverage and negative dependencies; incremental silence never proves resolution.",
    "source": "docs/contracts/core.md"
  },
  {
    "id": "CORE-10",
    "title": "Direct input bypass and explicit authority",
    "description": "Authenticated host/user controls bypass aggregation and attention budgets. Source text cannot mint authority, and cancellation epochs fence pending commits and dispatch.",
    "source": "docs/contracts/core.md"
  },
  {
    "id": "CORE-11",
    "title": "Typed rules and honest evaluation outcomes",
    "description": "Rules declare meaning, evidence, outcomes, preconditions, limits, dependencies, and consequence permissions. Judgments separate execution, semantic outcome, qualification, and authority.",
    "source": "docs/contracts/rules.md"
  },
  {
    "id": "CORE-12",
    "title": "Versioned domain and audience policy profiles",
    "description": "Immutable profiles bind rules, parameters, authority, budgets, lifecycle edges, and conflict policies. Semantic changes alter bindings and qualification; audience preferences do not rewrite facts.",
    "source": "docs/contracts/rules.md"
  },
  {
    "id": "CORE-13",
    "title": "Dependent judgments compose explicitly",
    "description": "Independent nodes may batch; dependent nodes consume validated admissible outputs in later stages. Explicit conflict policy governs composition, and ranking never overrides required gates.",
    "source": "docs/contracts/rules.md"
  },
  {
    "id": "CORE-14",
    "title": "Assessments bind complete context and evidence",
    "description": "Assessments bind exact matter, policy, purpose, relevant audience, evidence, time, and dependencies. Cached judgments require semantic equivalence and preserve uncertainty and change causes.",
    "source": "docs/contracts/rules.md"
  },
  {
    "id": "CORE-15",
    "title": "Freshness follows declared dependency changes",